<?xml version="1.0"?>
<?xml-stylesheet type="text/xsl" href="../squad.xsl" ?>
<!DOCTYPE squad SYSTEM "squad.dtd">
<squad nick="TF47-S">
	<name>TF47-Stammspieler</name>
	<email>taskforce47@web.de</email>
	<web>https://taskforce47.com</web>
	<picture>logo.paa</picture>
	<title>TF47-Stammspieler</title>
	<member id="76561198023782694" nick="Dragon">
		<name>Dragon</name>
		<email>string</email>
		<icq>N/A</icq>
		<remark>string</remark>
	</member>
</squad>
